"","pclass","survived","name","sex","age","sibsp","parch","ticket","fare","cabin","embarked"
"664",3,0,"Coleff, Mr. Peju","male",36,0,0,"349210",7.4958,"","S"
"665",3,1,"Lindqvist, Mr. Eino William","male",20,1,0,"STON/O 2. 3101285",7.925,"","S"
"666",2,0,"Hickman, Mr. Lewis","male",32,2,0,"S.O.C. 14879",73.5,"","S"
"667",2,0,"Butler, Mr. Reginald Fenton","male",25,0,0,"234686",13,"","S"
"668",3,0,"Rommetvedt, Mr. Knud Paust","male",NA,0,0,"312993",7.775,"","S"
"669",3,0,"Cook, Mr. Jacob","male",43,0,0,"A/5 3536",8.05,"","S"
"670",1,1,"Taylor, Mrs. Elmer Zebley (Juliet Cummins Wright)","female",NA,1,0,"19996",52,"C126","S"
"671",2,1,"Brown, Mrs. Thomas William Solomon (Elizabeth Catherine Ford)","female",40,1,1,"29750",39,"","S"
"672",1,0,"Davidson, Mr. Thornton","male",31,1,0,"F.C. 12750",52,"B71","S"
"673",2,0,"Mitchell, Mr. Henry Michael","male",70,0,0,"C.A. 24580",10.5,"","S"
"674",2,1,"Wilhelms, Mr. Charles","male",31,0,0,"244270",13,"","S"
"675",2,0,"Watson, Mr. Ennis Hastings","male",NA,0,0,"239856",0,"","S"
"676",3,0,"Edvardsson, Mr. Gustaf Hjalmar","male",18,0,0,"349912",7.775,"","S"
"677",3,0,"Sawyer, Mr. Frederick Charles","male",24.5,0,0,"342826",8.05,"","S"
"678",3,1,"Turja, Miss. Anna Sofia","female",18,0,0,"4138",9.8417,"","S"
"679",3,0,"Goodwin, Mrs. Frederick (Augusta Tyler)","female",43,1,6,"CA 2144",46.9,"","S"
"680",1,1,"Cardeza, Mr. Thomas Drake Martinez","male",36,0,1,"PC 17755",512.3292,"B51 B53 B55","C"
"681",3,0,"Peters, Miss. Katie","female",NA,0,0,"330935",8.1375,"","Q"
"682",1,1,"Hassab, Mr. Hammad","male",27,0,0,"PC 17572",76.7292,"D49","C"
"683",3,0,"Olsvigen, Mr. Thor Anderson","male",20,0,0,"6563",9.225,"","S"
"684",3,0,"Goodwin, Mr. Charles Edward","male",14,5,2,"CA 2144",46.9,"","S"
"685",2,0,"Brown, Mr. Thomas William Solomon","male",60,1,1,"29750",39,"","S"
"686",2,0,"Laroche, Mr. Joseph Philippe Lemercier","male",25,1,2,"SC/Paris 2123",41.5792,"","C"
"687",3,0,"Panula, Mr. Jaako Arnold","male",14,4,1,"3101295",39.6875,"","S"
"688",3,0,"Dakic, Mr. Branko","male",19,0,0,"349228",10.1708,"","S"
"689",3,0,"Fischer, Mr. Eberhard Thelander","male",18,0,0,"350036",7.7958,"","S"
"690",1,1,"Madill, Miss. Georgette Alexandra","female",15,0,1,"24160",211.3375,"B5","S"
"691",1,1,"Dick, Mr. Albert Adrian","male",31,1,0,"17474",57,"B20","S"
"692",3,1,"Karun, Miss. Manca","female",4,0,1,"349256",13.4167,"","C"
"693",3,1,"Lam, Mr. Ali","male",NA,0,0,"1601",56.4958,"","S"
"694",3,0,"Saad, Mr. Khalil","male",25,0,0,"2672",7.225,"","C"
"695",1,0,"Weir, Col. John","male",60,0,0,"113800",26.55,"","S"
"696",2,0,"Chapman, Mr. Charles Henry","male",52,0,0,"248731",13.5,"","S"
"697",3,0,"Kelly, Mr. James","male",34.5,0,0,"330911",7.8292,"","Q"
"698",3,1,"Mullens, Miss. Katherine ""Katie""","female",NA,0,0,"35852",7.7333,"","Q"
"699",1,0,"Thayer, Mr. John Borland","male",49,1,1,"17421",110.8833,"C68","C"
"700",3,0,"Humblen, Mr. Adolf Mathias Nicolai Olsen","male",42,0,0,"348121",7.65,"F G63","S"
"701",1,1,"Astor, Mrs. John Jacob (Madeleine Talmadge Force)","female",18,1,0,"PC 17757",227.525,"C62 C64","C"
"702",1,1,"Silverthorne, Mr. Spencer Victor","male",35,0,0,"PC 17475",26.2875,"E24","S"
"703",3,0,"Barbara, Miss. Saiide","female",18,0,1,"2691",14.4542,"","C"
"704",3,0,"Gallagher, Mr. Martin","male",25,0,0,"36864",7.7417,"","Q"
"705",3,0,"Hansen, Mr. Henrik Juul","male",26,1,0,"350025",7.8542,"","S"
"706",2,0,"Morley, Mr. Henry Samuel (""Mr Henry Marshall"")","male",39,0,0,"250655",26,"","S"
"707",2,1,"Kelly, Mrs. Florence ""Fannie""","female",45,0,0,"223596",13.5,"","S"
"708",1,1,"Calderhead, Mr. Edward Pennington","male",42,0,0,"PC 17476",26.2875,"E24","S"
"709",1,1,"Cleaver, Miss. Alice","female",22,0,0,"113781",151.55,"","S"
"710",3,1,"Moubarek, Master. Halim Gonios (""William George"")","male",NA,1,1,"2661",15.2458,"","C"
"711",1,1,"Mayne, Mlle. Berthe Antonine (""Mrs de Villiers"")","female",24,0,0,"PC 17482",49.5042,"C90","C"
"712",1,0,"Klaber, Mr. Herman","male",NA,0,0,"113028",26.55,"C124","S"
"713",1,1,"Taylor, Mr. Elmer Zebley","male",48,1,0,"19996",52,"C126","S"
"714",3,0,"Larsson, Mr. August Viktor","male",29,0,0,"7545",9.4833,"","S"
"715",2,0,"Greenberg, Mr. Samuel","male",52,0,0,"250647",13,"","S"
"716",3,0,"Soholt, Mr. Peter Andreas Lauritz Andersen","male",19,0,0,"348124",7.65,"F G73","S"
"717",1,1,"Endres, Miss. Caroline Louise","female",38,0,0,"PC 17757",227.525,"C45","C"
"718",2,1,"Troutt, Miss. Edwina Celia ""Winnie""","female",27,0,0,"34218",10.5,"E101","S"
"719",3,0,"McEvoy, Mr. Michael","male",NA,0,0,"36568",15.5,"","Q"
"720",3,0,"Johnson, Mr. Malkolm Joackim","male",33,0,0,"347062",7.775,"","S"
"721",2,1,"Harper, Miss. Annie Jessie ""Nina""","female",6,0,1,"248727",33,"","S"
"722",3,0,"Jensen, Mr. Svend Lauritz","male",17,1,0,"350048",7.0542,"","S"
"723",2,0,"Gillespie, Mr. William Henry","male",34,0,0,"12233",13,"","S"
"724",2,0,"Hodges, Mr. Henry Price","male",50,0,0,"250643",13,"","S"
"725",1,1,"Chambers, Mr. Norman Campbell","male",27,1,0,"113806",53.1,"E8","S"
"726",3,0,"Oreskovic, Mr. Luka","male",20,0,0,"315094",8.6625,"","S"
"727",2,1,"Renouf, Mrs. Peter Henry (Lillian Jefferys)","female",30,3,0,"31027",21,"","S"
"728",3,1,"Mannion, Miss. Margareth","female",NA,0,0,"36866",7.7375,"","Q"
"729",2,0,"Bryhl, Mr. Kurt Arnold Gottfrid","male",25,1,0,"236853",26,"","S"
"730",3,0,"Ilmakangas, Miss. Pieta Sofia","female",25,1,0,"STON/O2. 3101271",7.925,"","S"
"731",1,1,"Allen, Miss. Elisabeth Walton","female",29,0,0,"24160",211.3375,"B5","S"
"732",3,0,"Hassan, Mr. Houssein G N","male",11,0,0,"2699",18.7875,"","C"
"733",2,0,"Knight, Mr. Robert J","male",NA,0,0,"239855",0,"","S"
"734",2,0,"Berriman, Mr. William John","male",23,0,0,"28425",13,"","S"
"735",2,0,"Troupiansky, Mr. Moses Aaron","male",23,0,0,"233639",13,"","S"
"736",3,0,"Williams, Mr. Leslie","male",28.5,0,0,"54636",16.1,"","S"
"737",3,0,"Ford, Mrs. Edward (Margaret Ann Watson)","female",48,1,3,"W./C. 6608",34.375,"","S"
"738",1,1,"Lesurer, Mr. Gustave J","male",35,0,0,"PC 17755",512.3292,"B101","C"
"739",3,0,"Ivanoff, Mr. Kanio","male",NA,0,0,"349201",7.8958,"","S"
"740",3,0,"Nankoff, Mr. Minko","male",NA,0,0,"349218",7.8958,"","S"
"741",1,1,"Hawksford, Mr. Walter James","male",NA,0,0,"16988",30,"D45","S"
"742",1,0,"Cavendish, Mr. Tyrell William","male",36,1,0,"19877",78.85,"C46","S"
"743",1,1,"Ryerson, Miss. Susan Parker ""Suzette""","female",21,2,2,"PC 17608",262.375,"B57 B59 B63 B66","C"
"744",3,0,"McNamee, Mr. Neal","male",24,1,0,"376566",16.1,"","S"
"745",3,1,"Stranden, Mr. Juho","male",31,0,0,"STON/O 2. 3101288",7.925,"","S"
"746",1,0,"Crosby, Capt. Edward Gifford","male",70,1,1,"WE/P 5735",71,"B22","S"
"747",3,0,"Abbott, Mr. Rossmore Edward","male",16,1,1,"C.A. 2673",20.25,"","S"
"748",2,1,"Sinkkonen, Miss. Anna","female",30,0,0,"250648",13,"","S"
"749",1,0,"Marvin, Mr. Daniel Warner","male",19,1,0,"113773",53.1,"D30","S"
"750",3,0,"Connaghton, Mr. Michael","male",31,0,0,"335097",7.75,"","Q"
"751",2,1,"Wells, Miss. Joan","female",4,1,1,"29103",23,"","S"
"752",3,1,"Moor, Master. Meier","male",6,0,1,"392096",12.475,"E121","S"
"753",3,0,"Vande Velde, Mr. Johannes Joseph","male",33,0,0,"345780",9.5,"","S"
"754",3,0,"Jonkoff, Mr. Lalio","male",23,0,0,"349204",7.8958,"","S"
"755",2,1,"Herman, Mrs. Samuel (Jane Laver)","female",48,1,2,"220845",65,"","S"
"756",2,1,"Hamalainen, Master. Viljo","male",0.67,1,1,"250649",14.5,"","S"
"757",3,0,"Carlsson, Mr. August Sigfrid","male",28,0,0,"350042",7.7958,"","S"
"758",2,0,"Bailey, Mr. Percy Andrew","male",18,0,0,"29108",11.5,"","S"
"759",3,0,"Theobald, Mr. Thomas Leonard","male",34,0,0,"363294",8.05,"","S"
"760",1,1,"Rothes, the Countess. of (Lucy Noel Martha Dyer-Edwards)","female",33,0,0,"110152",86.5,"B77","S"
"761",3,0,"Garfirth, Mr. John","male",NA,0,0,"358585",14.5,"","S"
"762",3,0,"Nirva, Mr. Iisakki Antino Aijo","male",41,0,0,"SOTON/O2 3101272",7.125,"","S"
"763",3,1,"Barah, Mr. Hanna Assi","male",20,0,0,"2663",7.2292,"","C"
"764",1,1,"Carter, Mrs. William Ernest (Lucile Polk)","female",36,1,2,"113760",120,"B96 B98","S"
"765",3,0,"Eklund, Mr. Hans Linus","male",16,0,0,"347074",7.775,"","S"
"766",1,1,"Hogeboom, Mrs. John C (Anna Andrews)","female",51,1,0,"13502",77.9583,"D11","S"
"767",1,0,"Brewe, Dr. Arthur Jackson","male",NA,0,0,"112379",39.6,"","C"
"768",3,0,"Mangan, Miss. Mary","female",30.5,0,0,"364850",7.75,"","Q"
"769",3,0,"Moran, Mr. Daniel J","male",NA,1,0,"371110",24.15,"","Q"
"770",3,0,"Gronnestad, Mr. Daniel Danielsen","male",32,0,0,"8471",8.3625,"","S"
"771",3,0,"Lievens, Mr. Rene Aime","male",24,0,0,"345781",9.5,"","S"
"772",3,0,"Jensen, Mr. Niels Peder","male",48,0,0,"350047",7.8542,"","S"
"773",2,0,"Mack, Mrs. (Mary)","female",57,0,0,"S.O./P.P. 3",10.5,"E77","S"
"774",3,0,"Elias, Mr. Dibo","male",NA,0,0,"2674",7.225,"","C"
"775",2,1,"Hocking, Mrs. Elizabeth (Eliza Needs)","female",54,1,3,"29105",23,"","S"
"776",3,0,"Myhrman, Mr. Pehr Fabian Oliver Malkolm","male",18,0,0,"347078",7.75,"","S"
"777",3,0,"Tobin, Mr. Roger","male",NA,0,0,"383121",7.75,"F38","Q"
"778",3,1,"Emanuel, Miss. Virginia Ethel","female",5,0,0,"364516",12.475,"","S"
"779",3,0,"Kilgannon, Mr. Thomas J","male",NA,0,0,"36865",7.7375,"","Q"
"780",1,1,"Robert, Mrs. Edward Scott (Elisabeth Walton McMillan)","female",43,0,1,"24160",211.3375,"B3","S"
"781",3,1,"Ayoub, Miss. Banoura","female",13,0,0,"2687",7.2292,"","C"
"782",1,1,"Dick, Mrs. Albert Adrian (Vera Gillespie)","female",17,1,0,"17474",57,"B20","S"
"783",1,0,"Long, Mr. Milton Clyde","male",29,0,0,"113501",30,"D6","S"
"784",3,0,"Johnston, Mr. Andrew G","male",NA,1,2,"W./C. 6607",23.45,"","S"
"785",3,0,"Ali, Mr. William","male",25,0,0,"SOTON/O.Q. 3101312",7.05,"","S"
"786",3,0,"Harmer, Mr. Abraham (David Lishin)","male",25,0,0,"374887",7.25,"","S"
"787",3,1,"Sjoblom, Miss. Anna Sofia","female",18,0,0,"3101265",7.4958,"","S"
"788",3,0,"Rice, Master. George Hugh","male",8,4,1,"382652",29.125,"","Q"
"789",3,1,"Dean, Master. Bertram Vere","male",1,1,2,"C.A. 2315",20.575,"","S"
"790",1,0,"Guggenheim, Mr. Benjamin","male",46,0,0,"PC 17593",79.2,"B82 B84","C"
"791",3,0,"Keane, Mr. Andrew ""Andy""","male",NA,0,0,"12460",7.75,"","Q"
"792",2,0,"Gaskell, Mr. Alfred","male",16,0,0,"239865",26,"","S"
"793",3,0,"Sage, Miss. Stella Anna","female",NA,8,2,"CA. 2343",69.55,"","S"
"794",1,0,"Hoyt, Mr. William Fisher","male",NA,0,0,"PC 17600",30.6958,"","C"
"795",3,0,"Dantcheff, Mr. Ristiu","male",25,0,0,"349203",7.8958,"","S"
"796",2,0,"Otter, Mr. Richard","male",39,0,0,"28213",13,"","S"
"797",1,1,"Leader, Dr. Alice (Farnham)","female",49,0,0,"17465",25.9292,"D17","S"
"798",3,1,"Osman, Mrs. Mara","female",31,0,0,"349244",8.6833,"","S"
"799",3,0,"Ibrahim Shawah, Mr. Yousseff","male",30,0,0,"2685",7.2292,"","C"
"800",3,0,"Van Impe, Mrs. Jean Baptiste (Rosalie Paula Govaert)","female",30,1,1,"345773",24.15,"","S"
"801",2,0,"Ponesell, Mr. Martin","male",34,0,0,"250647",13,"","S"
"802",2,1,"Collyer, Mrs. Harvey (Charlotte Annie Tate)","female",31,1,1,"C.A. 31921",26.25,"","S"
"803",1,1,"Carter, Master. William Thornton II","male",11,1,2,"113760",120,"B96 B98","S"
"804",3,1,"Thomas, Master. Assad Alexander","male",0.42,0,1,"2625",8.5167,"","C"
"805",3,1,"Hedman, Mr. Oskar Arvid","male",27,0,0,"347089",6.975,"","S"
"806",3,0,"Johansson, Mr. Karl Johan","male",31,0,0,"347063",7.775,"","S"
"807",1,0,"Andrews, Mr. Thomas Jr","male",39,0,0,"112050",0,"A36","S"
"808",3,0,"Pettersson, Miss. Ellen Natalia","female",18,0,0,"347087",7.775,"","S"
"809",2,0,"Meyer, Mr. August","male",39,0,0,"248723",13,"","S"
"810",1,1,"Chambers, Mrs. Norman Campbell (Bertha Griggs)","female",33,1,0,"113806",53.1,"E8","S"
"811",3,0,"Alexander, Mr. William","male",26,0,0,"3474",7.8875,"","S"
"812",3,0,"Lester, Mr. James","male",39,0,0,"A/4 48871",24.15,"","S"
"813",2,0,"Slemen, Mr. Richard James","male",35,0,0,"28206",10.5,"","S"
"814",3,0,"Andersson, Miss. Ebba Iris Alfrida","female",6,4,2,"347082",31.275,"","S"
"815",3,0,"Tomlin, Mr. Ernest Portage","male",30.5,0,0,"364499",8.05,"","S"
"816",1,0,"Fry, Mr. Richard","male",NA,0,0,"112058",0,"B102","S"
"817",3,0,"Heininen, Miss. Wendla Maria","female",23,0,0,"STON/O2. 3101290",7.925,"","S"
"818",2,0,"Mallet, Mr. Albert","male",31,1,1,"S.C./PARIS 2079",37.0042,"","C"
"819",3,0,"Holm, Mr. John Fredrik Alexander","male",43,0,0,"C 7075",6.45,"","S"
"820",3,0,"Skoog, Master. Karl Thorsten","male",10,3,2,"347088",27.9,"","S"
"821",1,1,"Hays, Mrs. Charles Melville (Clara Jennings Gregg)","female",52,1,1,"12749",93.5,"B69","S"
"822",3,1,"Lulic, Mr. Nikola","male",27,0,0,"315098",8.6625,"","S"
"823",1,0,"Reuchlin, Jonkheer. John George","male",38,0,0,"19972",0,"","S"
"824",3,1,"Moor, Mrs. (Beila)","female",27,0,1,"392096",12.475,"E121","S"
"825",3,0,"Panula, Master. Urho Abraham","male",2,4,1,"3101295",39.6875,"","S"
"826",3,0,"Flynn, Mr. John","male",NA,0,0,"368323",6.95,"","Q"
"827",3,0,"Lam, Mr. Len","male",NA,0,0,"1601",56.4958,"","S"
"828",2,1,"Mallet, Master. Andre","male",1,0,2,"S.C./PARIS 2079",37.0042,"","C"
"829",3,1,"McCormack, Mr. Thomas Joseph","male",NA,0,0,"367228",7.75,"","Q"
"830",1,1,"Stone, Mrs. George Nelson (Martha Evelyn)","female",62,0,0,"113572",80,"B28",NA
"831",3,1,"Yasbeck, Mrs. Antoni (Selini Alexander)","female",15,1,0,"2659",14.4542,"","C"
"832",2,1,"Richards, Master. George Sibley","male",0.83,1,1,"29106",18.75,"","S"
"833",3,0,"Saad, Mr. Amin","male",NA,0,0,"2671",7.2292,"","C"
"834",3,0,"Augustsson, Mr. Albert","male",23,0,0,"347468",7.8542,"","S"
"835",3,0,"Allum, Mr. Owen George","male",18,0,0,"2223",8.3,"","S"
"836",1,1,"Compton, Miss. Sara Rebecca","female",39,1,1,"PC 17756",83.1583,"E49","C"
"837",3,0,"Pasic, Mr. Jakob","male",21,0,0,"315097",8.6625,"","S"
"838",3,0,"Sirota, Mr. Maurice","male",NA,0,0,"392092",8.05,"","S"
"839",3,1,"Chip, Mr. Chang","male",32,0,0,"1601",56.4958,"","S"
"840",1,1,"Marechal, Mr. Pierre","male",NA,0,0,"11774",29.7,"C47","C"
"841",3,0,"Alhomaki, Mr. Ilmari Rudolf","male",20,0,0,"SOTON/O2 3101287",7.925,"","S"
"842",2,0,"Mudd, Mr. Thomas Charles","male",16,0,0,"S.O./P.P. 3",10.5,"","S"
"843",1,1,"Serepeca, Miss. Augusta","female",30,0,0,"113798",31,"","C"
"844",3,0,"Lemberopolous, Mr. Peter L","male",34.5,0,0,"2683",6.4375,"","C"
"845",3,0,"Culumovic, Mr. Jeso","male",17,0,0,"315090",8.6625,"","S"
"846",3,0,"Abbing, Mr. Anthony","male",42,0,0,"C.A. 5547",7.55,"","S"
"847",3,0,"Sage, Mr. Douglas Bullen","male",NA,8,2,"CA. 2343",69.55,"","S"
"848",3,0,"Markoff, Mr. Marin","male",35,0,0,"349213",7.8958,"","C"
"849",2,0,"Harper, Rev. John","male",28,0,1,"248727",33,"","S"
"850",1,1,"Goldenberg, Mrs. Samuel L (Edwiga Grabowska)","female",NA,1,0,"17453",89.1042,"C92","C"
"851",3,0,"Andersson, Master. Sigvard Harald Elias","male",4,4,2,"347082",31.275,"","S"
"852",3,0,"Svensson, Mr. Johan","male",74,0,0,"347060",7.775,"","S"
"853",3,0,"Boulos, Miss. Nourelain","female",9,1,1,"2678",15.2458,"","C"
"854",1,1,"Lines, Miss. Mary Conover","female",16,0,1,"PC 17592",39.4,"D28","S"
"855",2,0,"Carter, Mrs. Ernest Courtenay (Lilian Hughes)","female",44,1,0,"244252",26,"","S"
"856",3,1,"Aks, Mrs. Sam (Leah Rosen)","female",18,0,1,"392091",9.35,"","S"
"857",1,1,"Wick, Mrs. George Dennick (Mary Hitchcock)","female",45,1,1,"36928",164.8667,"","S"
"858",1,1,"Daly, Mr. Peter Denis ","male",51,0,0,"113055",26.55,"E17","S"
"859",3,1,"Baclini, Mrs. Solomon (Latifa Qurban)","female",24,0,3,"2666",19.2583,"","C"
"860",3,0,"Razi, Mr. Raihed","male",NA,0,0,"2629",7.2292,"","C"
"861",3,0,"Hansen, Mr. Claus Peter","male",41,2,0,"350026",14.1083,"","S"
"862",2,0,"Giles, Mr. Frederick Edward","male",21,1,0,"28134",11.5,"","S"
"863",1,1,"Swift, Mrs. Frederick Joel (Margaret Welles Barron)","female",48,0,0,"17466",25.9292,"D17","S"
"864",3,0,"Sage, Miss. Dorothy Edith ""Dolly""","female",NA,8,2,"CA. 2343",69.55,"","S"
"865",2,0,"Gill, Mr. John William","male",24,0,0,"233866",13,"","S"
"866",2,1,"Bystrom, Mrs. (Karolina)","female",42,0,0,"236852",13,"","S"
"867",2,1,"Duran y More, Miss. Asuncion","female",27,1,0,"SC/PARIS 2149",13.8583,"","C"
"868",1,0,"Roebling, Mr. Washington Augustus II","male",31,0,0,"PC 17590",50.4958,"A24","S"
"869",3,0,"van Melkebeke, Mr. Philemon","male",NA,0,0,"345777",9.5,"","S"
"870",3,1,"Johnson, Master. Harold Theodor","male",4,1,1,"347742",11.1333,"","S"
"871",3,0,"Balkic, Mr. Cerin","male",26,0,0,"349248",7.8958,"","S"
"872",1,1,"Beckwith, Mrs. Richard Leonard (Sallie Monypeny)","female",47,1,1,"11751",52.5542,"D35","S"
"873",1,0,"Carlsson, Mr. Frans Olof","male",33,0,0,"695",5,"B51 B53 B55","S"
"874",3,0,"Vander Cruyssen, Mr. Victor","male",47,0,0,"345765",9,"","S"
"875",2,1,"Abelson, Mrs. Samuel (Hannah Wizosky)","female",28,1,0,"P/PP 3381",24,"","C"
"876",3,1,"Najib, Miss. Adele Kiamie ""Jane""","female",15,0,0,"2667",7.225,"","C"
"877",3,0,"Gustafsson, Mr. Alfred Ossian","male",20,0,0,"7534",9.8458,"","S"
"878",3,0,"Petroff, Mr. Nedelio","male",19,0,0,"349212",7.8958,"","S"
"879",3,0,"Laleff, Mr. Kristo","male",NA,0,0,"349217",7.8958,"","S"
"880",1,1,"Potter, Mrs. Thomas Jr (Lily Alexenia Wilson)","female",56,0,1,"11767",83.1583,"C50","C"
"881",2,1,"Shelley, Mrs. William (Imanita Parrish Hall)","female",25,0,1,"230433",26,"","S"
"882",3,0,"Markun, Mr. Johann","male",33,0,0,"349257",7.8958,"","S"
"883",3,0,"Dahlberg, Miss. Gerda Ulrika","female",22,0,0,"7552",10.5167,"","S"
"884",2,0,"Banfield, Mr. Frederick James","male",28,0,0,"C.A./SOTON 34068",10.5,"","S"
"885",3,0,"Sutehall, Mr. Henry Jr","male",25,0,0,"SOTON/OQ 392076",7.05,"","S"
"886",3,0,"Rice, Mrs. William (Margaret Norton)","female",39,0,5,"382652",29.125,"","Q"
"887",2,0,"Montvila, Rev. Juozas","male",27,0,0,"211536",13,"","S"
"888",1,1,"Graham, Miss. Margaret Edith","female",19,0,0,"112053",30,"B42","S"
"889",3,0,"Johnston, Miss. Catherine Helen ""Carrie""","female",NA,1,2,"W./C. 6607",23.45,"","S"
"890",1,1,"Behr, Mr. Karl Howell","male",26,0,0,"111369",30,"C148","C"
"891",3,0,"Dooley, Mr. Patrick","male",32,0,0,"370376",7.75,"","Q"
"892",3,0,"Braund, Mr. Owen Harris","male",22,1,0,"A/5 21171",7.25,"","S"
"893",1,1,"Cumings, Mrs. John Bradley (Florence Briggs Thayer)","female",38,1,0,"PC 17599",71.2833,"C85","C"
"894",3,1,"Heikkinen, Miss. Laina","female",26,0,0,"STON/O2. 3101282",7.925,"","S"
"895",1,1,"Futrelle, Mrs. Jacques Heath (Lily May Peel)","female",35,1,0,"113803",53.1,"C123","S"
"896",3,0,"Allen, Mr. William Henry","male",35,0,0,"373450",8.05,"","S"
"897",3,0,"Moran, Mr. James","male",NA,0,0,"330877",8.4583,"","Q"
"898",1,0,"McCarthy, Mr. Timothy J","male",54,0,0,"17463",51.8625,"E46","S"
"899",3,0,"Palsson, Master. Gosta Leonard","male",2,3,1,"349909",21.075,"","S"
"900",3,1,"Johnson, Mrs. Oscar W (Elisabeth Vilhelmina Berg)","female",27,0,2,"347742",11.1333,"","S"
"901",2,1,"Nasser, Mrs. Nicholas (Adele Achem)","female",14,1,0,"237736",30.0708,"","C"
"902",3,1,"Sandstrom, Miss. Marguerite Rut","female",4,1,1,"PP 9549",16.7,"G6","S"
"903",1,1,"Bonnell, Miss. Elizabeth","female",58,0,0,"113783",26.55,"C103","S"
"904",3,0,"Saundercock, Mr. William Henry","male",20,0,0,"A/5. 2151",8.05,"","S"
"905",3,0,"Andersson, Mr. Anders Johan","male",39,1,5,"347082",31.275,"","S"
"906",3,0,"Vestrom, Miss. Hulda Amanda Adolfina","female",14,0,0,"350406",7.8542,"","S"
"907",2,1,"Hewlett, Mrs. (Mary D Kingcome) ","female",55,0,0,"248706",16,"","S"
"908",3,0,"Rice, Master. Eugene","male",2,4,1,"382652",29.125,"","Q"
"909",2,1,"Williams, Mr. Charles Eugene","male",NA,0,0,"244373",13,"","S"
"910",3,0,"Vander Planke, Mrs. Julius (Emelia Maria Vandemoortele)","female",31,1,0,"345763",18,"","S"
"911",3,1,"Masselmani, Mrs. Fatima","female",NA,0,0,"2649",7.225,"","C"
"912",2,0,"Fynney, Mr. Joseph J","male",35,0,0,"239865",26,"","S"
"913",2,1,"Beesley, Mr. Lawrence","male",34,0,0,"248698",13,"D56","S"
"914",3,1,"McGowan, Miss. Anna ""Annie""","female",15,0,0,"330923",8.0292,"","Q"
"915",1,1,"Sloper, Mr. William Thompson","male",28,0,0,"113788",35.5,"A6","S"
"916",3,0,"Palsson, Miss. Torborg Danira","female",8,3,1,"349909",21.075,"","S"
"917",3,1,"Asplund, Mrs. Carl Oscar (Selma Augusta Emilia Johansson)","female",38,1,5,"347077",31.3875,"","S"
"918",3,0,"Emir, Mr. Farred Chehab","male",NA,0,0,"2631",7.225,"","C"
"919",1,0,"Fortune, Mr. Charles Alexander","male",19,3,2,"19950",263,"C23 C25 C27","S"
"920",3,1,"O'Dwyer, Miss. Ellen ""Nellie""","female",NA,0,0,"330959",7.8792,"","Q"
"921",3,0,"Todoroff, Mr. Lalio","male",NA,0,0,"349216",7.8958,"","S"
"922",1,0,"Uruchurtu, Don. Manuel E","male",40,0,0,"PC 17601",27.7208,"","C"
"923",1,1,"Spencer, Mrs. William Augustus (Marie Eugenie)","female",NA,1,0,"PC 17569",146.5208,"B78","C"
"924",3,1,"Glynn, Miss. Mary Agatha","female",NA,0,0,"335677",7.75,"","Q"
"925",2,0,"Wheadon, Mr. Edward H","male",66,0,0,"C.A. 24579",10.5,"","S"
"926",1,0,"Meyer, Mr. Edgar Joseph","male",28,1,0,"PC 17604",82.1708,"","C"
"927",1,0,"Holverson, Mr. Alexander Oskar","male",42,1,0,"113789",52,"","S"
"928",3,1,"Mamee, Mr. Hanna","male",NA,0,0,"2677",7.2292,"","C"
"929",3,0,"Cann, Mr. Ernest Charles","male",21,0,0,"A./5. 2152",8.05,"","S"
"930",3,0,"Vander Planke, Miss. Augusta Maria","female",18,2,0,"345764",18,"","S"
"931",3,1,"Nicola-Yarred, Miss. Jamila","female",14,1,0,"2651",11.2417,"","C"
"932",3,0,"Ahlin, Mrs. Johan (Johanna Persdotter Larsson)","female",40,1,0,"7546",9.475,"","S"
"933",2,0,"Turpin, Mrs. William John Robert (Dorothy Ann Wonnacott)","female",27,1,0,"11668",21,"","S"
"934",3,0,"Kraeff, Mr. Theodor","male",NA,0,0,"349253",7.8958,"","C"
"935",2,1,"Laroche, Miss. Simonne Marie Anne Andree","female",3,1,2,"SC/Paris 2123",41.5792,"","C"
"936",3,1,"Devaney, Miss. Margaret Delia","female",19,0,0,"330958",7.8792,"","Q"
"937",3,0,"Rogers, Mr. William John","male",NA,0,0,"S.C./A.4. 23567",8.05,"","S"
"938",3,0,"Lennon, Mr. Denis","male",NA,1,0,"370371",15.5,"","Q"
"939",3,1,"O'Driscoll, Miss. Bridget","female",NA,0,0,"14311",7.75,"","Q"
"940",3,0,"Samaan, Mr. Youssef","male",NA,2,0,"2662",21.6792,"","C"
"941",3,0,"Arnold-Franchi, Mrs. Josef (Josefine Franchi)","female",18,1,0,"349237",17.8,"","S"
"942",3,0,"Panula, Master. Juha Niilo","male",7,4,1,"3101295",39.6875,"","S"
"943",3,0,"Nosworthy, Mr. Richard Cater","male",21,0,0,"A/4. 39886",7.8,"","S"
"944",1,1,"Harper, Mrs. Henry Sleeper (Myna Haxtun)","female",49,1,0,"PC 17572",76.7292,"D33","C"
"945",2,1,"Faunthorpe, Mrs. Lizzie (Elizabeth Anne Wilkinson)","female",29,1,0,"2926",26,"","S"
"946",1,0,"Ostby, Mr. Engelhart Cornelius","male",65,0,1,"113509",61.9792,"B30","C"
"947",1,1,"Woolner, Mr. Hugh","male",NA,0,0,"19947",35.5,"C52","S"
"948",2,1,"Rugg, Miss. Emily","female",21,0,0,"C.A. 31026",10.5,"","S"
"949",3,0,"Novel, Mr. Mansouer","male",28.5,0,0,"2697",7.2292,"","C"
"950",2,1,"West, Miss. Constance Mirium","female",5,1,2,"C.A. 34651",27.75,"","S"
"951",3,0,"Goodwin, Master. William Frederick","male",11,5,2,"CA 2144",46.9,"","S"
"952",3,0,"Sirayanian, Mr. Orsen","male",22,0,0,"2669",7.2292,"","C"
"953",1,1,"Icard, Miss. Amelie","female",38,0,0,"113572",80,"B28",NA
"954",1,0,"Harris, Mr. Henry Birkhardt","male",45,1,0,"36973",83.475,"C83","S"
"955",3,0,"Skoog, Master. Harald","male",4,3,2,"347088",27.9,"","S"
"956",1,0,"Stewart, Mr. Albert A","male",NA,0,0,"PC 17605",27.7208,"","C"
"957",3,1,"Moubarek, Master. Gerios","male",NA,1,1,"2661",15.2458,"","C"
"958",2,1,"Nye, Mrs. (Elizabeth Ramell)","female",29,0,0,"C.A. 29395",10.5,"F33","S"
"959",3,0,"Crease, Mr. Ernest James","male",19,0,0,"S.P. 3464",8.1583,"","S"
"960",3,1,"Andersson, Miss. Erna Alexandra","female",17,4,2,"3101281",7.925,"","S"
"961",3,0,"Kink, Mr. Vincenz","male",26,2,0,"315151",8.6625,"","S"
"962",2,0,"Jenkin, Mr. Stephen Curnow","male",32,0,0,"C.A. 33111",10.5,"","S"
"963",3,0,"Goodwin, Miss. Lillian Amy","female",16,5,2,"CA 2144",46.9,"","S"
"964",2,0,"Hood, Mr. Ambrose Jr","male",21,0,0,"S.O.C. 14879",73.5,"","S"
"965",3,0,"Chronopoulos, Mr. Apostolos","male",26,1,0,"2680",14.4542,"","C"
"966",3,1,"Bing, Mr. Lee","male",32,0,0,"1601",56.4958,"","S"
"967",3,0,"Moen, Mr. Sigurd Hansen","male",25,0,0,"348123",7.65,"F G73","S"
"968",3,0,"Staneff, Mr. Ivan","male",NA,0,0,"349208",7.8958,"","S"
"969",3,0,"Moutal, Mr. Rahamin Haim","male",NA,0,0,"374746",8.05,"","S"
"970",2,1,"Caldwell, Master. Alden Gates","male",0.83,0,2,"248738",29,"","S"
"971",3,1,"Dowdell, Miss. Elizabeth","female",30,0,0,"364516",12.475,"","S"
"972",3,0,"Waelens, Mr. Achille","male",22,0,0,"345767",9,"","S"
"973",3,1,"Sheerlinck, Mr. Jan Baptist","male",29,0,0,"345779",9.5,"","S"
"974",3,1,"McDermott, Miss. Brigdet Delia","female",NA,0,0,"330932",7.7875,"","Q"
"975",1,0,"Carrau, Mr. Francisco M","male",28,0,0,"113059",47.1,"","S"
"976",2,1,"Ilett, Miss. Bertha","female",17,0,0,"SO/C 14885",10.5,"","S"
"977",3,1,"Backstrom, Mrs. Karl Alfred (Maria Mathilda Gustafsson)","female",33,3,0,"3101278",15.85,"","S"
"978",3,0,"Ford, Mr. William Neal","male",16,1,3,"W./C. 6608",34.375,"","S"
"979",3,0,"Slocovski, Mr. Selman Francis","male",NA,0,0,"SOTON/OQ 392086",8.05,"","S"
"980",1,1,"Fortune, Miss. Mabel Helen","female",23,3,2,"19950",263,"C23 C25 C27","S"
"981",3,0,"Celotti, Mr. Francesco","male",24,0,0,"343275",8.05,"","S"
"982",3,0,"Christmann, Mr. Emil","male",29,0,0,"343276",8.05,"","S"
"983",3,0,"Andreasson, Mr. Paul Edvin","male",20,0,0,"347466",7.8542,"","S"
"984",1,0,"Chaffee, Mr. Herbert Fuller","male",46,1,0,"W.E.P. 5734",61.175,"E31","S"
"985",3,0,"Dean, Mr. Bertram Frank","male",26,1,2,"C.A. 2315",20.575,"","S"
"986",3,0,"Coxon, Mr. Daniel","male",59,0,0,"364500",7.25,"","S"
"987",3,0,"Shorney, Mr. Charles Joseph","male",NA,0,0,"374910",8.05,"","S"
"988",1,0,"Goldschmidt, Mr. George B","male",71,0,0,"PC 17754",34.6542,"A5","C"
"989",1,1,"Greenfield, Mr. William Bertram","male",23,0,1,"PC 17759",63.3583,"D10 D12","C"
"990",2,1,"Doling, Mrs. John T (Ada Julia Bone)","female",34,0,1,"231919",23,"","S"
"991",2,0,"Kantor, Mr. Sinai","male",34,1,0,"244367",26,"","S"
"992",3,0,"Petranec, Miss. Matilda","female",28,0,0,"349245",7.8958,"","S"
"993",3,0,"Petroff, Mr. Pastcho (""Pentcho"")","male",NA,0,0,"349215",7.8958,"","S"
